{
  "schema_version": 1,
  "id": "00000000-0000-4000-8000-000000000500",
  "read_only": true,
  "generated_at": "2026-08-25T08:00:00Z",
  "app": {
    "build": "2026.08.1",
    "version": "0.1.0"
  },
  "environment": {
    "os": "windows-11",
    "arch": "x86_64"
  },
  "checks": [],
  "logs": [],
  "assets": [],
  "assets_fingerprint": "e3b0c44298fc1c149afbf4c8996fb92427ae41e4649b934ca495991b7852b855"
}
